{
  "charterSpecVersion": "1.3.0",
  "namespace": "harbor.example",
  "kind": "BusinessProcess",
  "id": "PROC-RESOLVE-ORDER-EXCEPTION",
  "enterpriseId": "ENT-HARBOR",
  "name": "Resolve Order Exception",
  "valueStreamId": "VS-FULFILL-CUSTOMER-ORDER",
  "businessOutcome": "A blocked order is safely released, explicitly rejected, or escalated to an accountable authority",
  "processDefinitionVersion": "1",
  "aliases": [
    "order exception handling"
  ]
}
